,name,link,description
0,SR-NASDAQ-2025-007,https://listingcenter.nasdaq.com/assets/rulebook/nasdaq/filings/SR-NASDAQ-2025-007.pdf,"A proposal to change Nasdaq's Listing Rules to reflect a Federal court's vacatur of the Commission's order of August 6, 2021, approving rules related to Board diversity disclosures."
1,SR-NASDAQ-2025-006,https://listingcenter.nasdaq.com/assets/rulebook/nasdaq/filings/SR-NASDAQ-2025-006.pdf,A proposal to update certain representations regarding the Trust's service providers and basket size made in the proposed rule change previously filed with and approved by the Commission relating to the Hashdex Nasdaq Crypto Index US ETF under Nasdaq Rule 5711(d).
2,SR-NASDAQ-2025-005,https://listingcenter.nasdaq.com/assets/rulebook/nasdaq/filings/SR-NASDAQ-2025-005.pdf,"A proposed rule change to list and trade shares of the Canary Litecoin ETF (the ""Trust"") under Nasdaq Rule 5711(d) (""Commodity-Based Trust Shares""). The shares of the Trust are referred to herein as the ""Shares."""
3,SR-NASDAQ-2025-004,https://listingcenter.nasdaq.com/assets/rulebook/nasdaq/filings/SR-NASDAQ-2025-004.pdf,"A proposal to delay the Implementation of SR-NASDAQ-2024-078, Related to the Options Regulatory Fee."
4,SR-NASDAQ-2025-003,https://listingcenter.nasdaq.com/assets/rulebook/nasdaq/filings/SR-NASDAQ-2025-003.pdf,A proposal to establish fees for its expanded co-location services.
5,SR-NASDAQ-2025-002,https://listingcenter.nasdaq.com/assets/rulebook/nasdaq/filings/SR-NASDAQ-2025-002.pdf,A proposed rule change to establish fees for Industry Members2 related to reasonably budgeted CAT costs of the National Market System Plan Governing the Consolidated Audit Trail for 2025.
6,SR-NASDAQ-2025-001,https://listingcenter.nasdaq.com/assets/rulebook/nasdaq/filings/SR-NASDAQ-2025-001.pdf,"A proposal to amend its fee schedule to (1) increase the Exchange's Membership Fee at Equity 7, Section 10, and (2) increase its Regulatory, Registration and Processing Fees at Equity 7, Section 30."
